1122@1@Prestige Premium Canarios@PAJAROS|Alimentación y Vitaminas|Mezclas de semillas@@0@@Prestige Premium Canaris es una mezcla de semillas de primera calidad, a la vez variada y equilibrada y que responde especialmente a las necesidades nutricionales específicas de su ave. Prestige Premium Canaris contiene croquetas VAM y frutas muy ricos en vitaminas, aminoácidos y minerales. Contiene Florastimul, lo que estimula la flora intestinal y protege contra los trastornos intestinales.<br /><br />Recomendamos mezclar piensos y semillas de diferentes fuentes (cuide que las semillas no sobrepasen el 20 a 30% de la ración diaria).<br /><br />Producto elaborado por Versele Laga, líder europeo de alimento para aves. Versele-Laga apoya a Loro Parque Fundación, que trabaja por la conservación de las especies de aves amenazadas y de su hábitat.@http://casadelave-tiendaonline.com/wordpress/wp-content/uploads/2015/04/20121116153707.jpg|http://casadelave-tiendaonline.com/wordpress/wp-content/uploads/2015/04/20121114102448.jpg
1129@1@Prestige Premium Exoticos@PAJAROS|Alimentación y Vitaminas|Mezclas de semillas@5@0@@Prestige Premium Exoticos es una mezcla de semillas de primera calidad, a la vez variada y equilibrada y que responde especialmente a las necesidades nutricionales específicas de su ave. Prestige Premium Exoticos contiene croquetas VAM y frutas muy ricos en vitaminas, aminoácidos y minerales. Contiene Florastimul, lo que estimula la flora intestinal y protege contra los trastornos intestinales.<br /><br />Recomendamos mezclar piensos y semillas de diferentes fuentes (cuide que las semillas no sobrepasen el 20 a 30% de la ración diaria).<br /><br />Producto elaborado por Versele Laga, líder europeo de alimento para aves. Versele-Laga apoya a Loro Parque Fundación, que trabaja por la conservación de las especies de aves amenazadas y de su hábitat.<br /><br />Peso: 1 kg@http://casadelave-tiendaonline.com/wordpress/wp-content/uploads/2015/04/20121116154129.jpg|http://casadelave-tiendaonline.com/wordpress/wp-content/uploads/2015/04/20121114104726.jpg
1132@1@Pretty Bird Lori Select@PAJAROS|Alimentación y Vitaminas|Piensos@13.5@0@@Pretty Bird es un alimento de nutritvo completo para su pajaro . Los sabores a fruta y las formas multiples mejoraran la experiencia alimenticia de sus pajaros.<br /><br />Ingredientes Maiz molido , avena molido ,trigo molido ,soja,harina de gluten de maiz , aceite de coco , Pasas , Coco , Papaya , Pina , Albaricoques , Platano ,Sweet batata , Manzana , Espinacas , Brocoli , Zanahoria   14 vitaminas y 9 minerales.<br /><br />Analisis Proteina 16% ,Grasa 6% ,Fibra 3%, Ceniza 4%,humedad 10% Aditivos Vitamina A 12000 UI ,Vitamina D3 800 IE ,Vitamina E 200mg , Cobre 10 mg.@http://casadelave-tiendaonline.com/wordpress/wp-content/uploads/2015/04/d_pretty-lory-select.jpg
1134@1@Oropharma C-Vit@ROEDORES|Champús y vitaminas@9.75@0@@Oropharma C-Vit es una preparación multivitaminas líquida, especialmente desarrollada para los cobayos. Hay una conciencia creciente del hecho que la vitamina C es esencial para los cobayos. Sin embargo, y al igual que los humanos, los cobayos no pueden producir ellos mismos esta vitamina. El promedio de los alimentos para cobayos debe contener ocasionalmente un poco de vitamina C, pero a menudo es inestable y por lo mismo, altamente putrescible. C-Vit contiene exclusivamente vitamina C estabilizada. Esto garantiza que el cobayo es capaz de absorber suficiente vitamina C. C-Vit contiene adicionalmente otras importantes vitaminas, las que ayudan a fortalecer la salud general y la resistencia natural. C-Vit también contiene L-carnitina (vitamina Bt). Esta substancia natural estimula el metabolismo de las grasas naturales y ayuda a mantener controlado el peso corporal.<br /><br />Modo de empleo<br />Para mantener una óptima condición física:<br />una vez a la semana 10 gotas en 100 ml agua de beber limpia.<br />Durante enfermedad y recuperación de enfermedad:<br />diariamente 15 gotas en 100 ml de agua de beber limpia; refrescar diariamente.<br /><br />Componentes analíticos<br />Aditivos nutricionales<br />Vitamina A       3.904.961      UI/kg<br />Vitamina D3       177.377      UI/kg<br />Vitamina E       4.520      mg/kg<br />Vitamina C       88.689      mg/kg<br />Vitamina K       111      mg/kg<br />Vitamina B1       316      mg/kg<br />Vitamina B2       399      mg/kg<br />Vitamina B6       438      mg/kg<br />Vitamina B12       0,044      mg/kg<br />Vitamina PP       177      mg/kg<br />Biotina       35      mg/kg<br />Ácido fólico       177      mg/kg<br />Acido D-pantoténico       355      mg/kg<br />L-carnitina       6.093      mg/kg<br /><br />Composición<br />Dextrosa<br />Sorbitol líquido@http://casadelave-tiendaonline.com/wordpress/wp-content/uploads/2015/04/460700.jpg
1137@1@RETORN PELLETS MADERA PRENSADA@ROEDORES|Lechos sanitarios@@0@@Fondo de jaula fabricado con fibras de madera, sin sustancias tóxicas. Ideal para gatos, pájaros y roedores.<br /><br />Beneficios:<br /><br />- Pellets precedentes de madera forestal, no tratada químicamente. No procede de madera de uso industrial.<br /><br />- Poder de absorción de un 240%.<br /><br />- Neutraliza los olores desagradables mediante el olor natural de la madera.<br /><br />- Muy económico, debido a su larga duración.<br /><br />- No se adhiere ni en el pelo ni a las plumas.<br /><br />- Producto ecológico y biodegradable.<br /><br />- Libre de polvo.<br /><br />No hace falta renovarlo a menudo por su fácil limpieza de los excrementos.<br /><br />Formato saco: 5 kg y 15 kg@http://casadelave-tiendaonline.com/wordpress/wp-content/uploads/2015/04/imagen.jpg
1143@1@Carry Me Large platinium@PAJAROS|Jaulas|Jaulas de transporte@95@0@@La jaula de transporte Carry Me Large es un modelo exclusivo del fabricante alemán Montana y líder mundial.<br /><br />Es, de lejos, el fabricante más serio y cuya alta calidad es reconocida. ¡No se fie de las imitaciones y las copias!<br /><br />Esta jaula se pliega y se despliega muy fácilmente para guardarla con comodidad.<br /><br />Gracias a su tamaño y a su solidez ¡esta jaula puede ser utilizada como jaula de fin de semana o de vacaciones!<br /><br />Se trata de un modelo adecuado para todos los loros de tamaño mediano, del tipo del loro gris africano, cacatúa Rosa, Eclecto, etc...<br /><br />Este modelo se entrega con 2 comederos y una percha.<br /><br />Entrega en 2 cajas:<br />. Caja : 52 x 70 x 10 cm<br />. Caja 2 : 13 x 18 x 6 cm@http://casadelave-tiendaonline.com/wordpress/wp-content/uploads/2015/04/201007060629092.jpg|http://casadelave-tiendaonline.com/wordpress/wp-content/uploads/2015/04/201007060629103.jpg
1146@1@Carry Me X-Large platinium@PAJAROS|Jaulas|Jaulas de transporte@110@0@@La jaula de transporte Carry Me X-Large es un modelo exclusivo del fabricante alemán Montana y líder mundial.<br />Es, de lejos, el fabricante más serio y cuya alta calidad es reconocida. ¡No se fie de las imitaciones y las copias!<br /><br />Esta jaula se pliega y se despliega muy fácilmente para guardarla con comodidad.<br /><br />Gracias a su tamaño y a su solidez ¡esta jaula puede ser utilizada como jaula de fin de semana o de vacaciones!<br /><br />Se trata de un modelo adecuado para todos los loros del tipo de las cacatúas grandes y aras.<br /><br />Este modelo se entrega con 2 comederos y una percha.<br /><br />Entrega en 2 cajas:<br />. Caja : 60 x 77 x 66 cm<br />. Caja 2 : 13 x 18 x 6 cm<br /><br />@http://casadelave-tiendaonline.com/wordpress/wp-content/uploads/2015/04/201011191205552.jpg|http://casadelave-tiendaonline.com/wordpress/wp-content/uploads/2015/04/201011191205563.jpg
1155@1@Toy branch@PAJAROS|Juguetes|Juguetes Java|PAJAROS|Accesorios|Perchas y palos@@0@@Elaborado con madera del árbol del café de gran dureza y resistencia.<br /><br />Dimensiones:<br />Small:2 cm a 2.5 cm x 30.20 cm ( diametro x largo )<br />Medium: 3 cm a 4 cm x 35.25 cm<br />Large: 4.5 cm a 5.5 cm x 40.30 cm<br /><br />Las medidas son orientativas ya que las perchas son naturales.@http://casadelave-tiendaonline.com/wordpress/wp-content/uploads/2015/04/d_toy-branch-03.jpg
1160@1@Cactus perch@PAJAROS|Accesorios|Perchas y palos@9@0@@Ligera, natural y entretenida.<br /><br />Medidas 25cm x 3.7 cm<br /><br />Adaptable a cualquier tipo de jaula.@http://casadelave-tiendaonline.com/wordpress/wp-content/uploads/2015/04/fich_col_cac_per.jpg
1163@1@Mochila X-small gold@PAJAROS|Accesorios|Transporte@287@0@@Accesorios:<br />. 2 correas, 1 correa bandolera,<br />. 2 listones de refuerzo, de plástico<br />. 1 fondo de plástico removible<br />. 2 comederos (diámetro 8 cm, altura 4 cm)<br />. 1 percha<br /><br />Materiales utilizados: nylon (1680-Denier) color Oro. Nylon (210-Denier) gris para las protecciones.<br /><br />Color: oro<br /><br />Advertencia: A pesar de los esfuerzos realizados por el fabricante, tenga en cuenta que el pico destructor de los loros puede causar deterioros. Por favor, tome todas las precauciones necesarias, y no deje nunca a un loro durante un largo período en una mochila PakObird sin atención. No se aceptará ningún reclamo relativo a eventuales deterioros.@http://casadelave-tiendaonline.com/wordpress/wp-content/uploads/2015/04/201204030312242.jpg|http://casadelave-tiendaonline.com/wordpress/wp-content/uploads/2015/04/201204030312231.jpg
1166@1@Mochila X-small oliva@PAJAROS|Accesorios|Transporte@287@0@@Accesorios:<br />. 2 correas, 1 correa bandolera,<br />. 2 listones de refuerzo, de plástico<br />. 1 fondo de plástico removible<br />. 2 comederos (diámetro 8 cm, altura 4 cm)<br />. 1 percha<br /><br />Materiales utilizados: nylon (1680-Denier) color Oliva. Nylon (210-Denier) gris para las protecciones.<br /><br />Color: oliva<br /><br />Advertencia: A pesar de los esfuerzos realizados por el fabricante, tenga en cuenta que el pico destructor de los loros puede causar deterioros. Por favor, tome todas las precauciones necesarias, y no deje nunca a un loro durante un largo período en una mochila PakObird sin atención. No se aceptará ningún reclamo relativo a eventuales deterioros.@http://casadelave-tiendaonline.com/wordpress/wp-content/uploads/2015/04/201204030312231.jpg|http://casadelave-tiendaonline.com/wordpress/wp-content/uploads/2015/04/201204030312242.jpg
1167@1@Water Bottle@PAJAROS|Accesorios|Transporte@27@0@@Todas las mochilas PakObird fueron diseñadas para disponer de un distribuidor de agua con una válvula.<br /><br />A este efecto se previeron una abertura así como un sistema de enganche.@http://casadelave-tiendaonline.com/wordpress/wp-content/uploads/2015/04/water_bottle_545x417.jpg|http://casadelave-tiendaonline.com/wordpress/wp-content/uploads/2015/04/20110326175753.jpg
1170@1@Mochila small gold@PAJAROS|Accesorios|Transporte@287@0@@Advertencia: A pesar de los esfuerzos realizados por el fabricante, tenga en cuenta que el pico destructor de los loros puede causar deterioros. Por favor, tome todas las precauciones necesarias, y no deje nunca a un loro durante un largo período en una mochila PakObird sin atención. No se aceptará ningún reclamo relativo a eventuales deterioros.<br /><br /><strong><span style=text-decoration: underline;>Descripción:</span></strong> Las mochilas PakObird están diseñadas para pasear a su loro y llevarlo con usted a dar un paseo. Este producto está fabricado de manera excelente, e incluye un montón de ideas prácticas para el bienestar de su pájaro.<br /><br />PakObird obtuvo numerosos premios en los Estados Unidos por la calidad y la ingeniosidad de sus productos.<br /><br />Cada mochila PakObird se entrega con una percha de « Dragon Wood », y dos comederos. Es posible agregar un distribuidor de agua con una válvula (ver el producto Water Bottle). Se han previsto una abertura y un sistema de colgado a este efecto.<br /><br />La mochila PakObird small es adecuada para el loro jardinero, youyou senegalés, loro de Meyer, cotorra del sol, cotorra Jandaya, cotorra cabeza azul, caique, etc.<br /><br />Aproveche su mochila al máximo, pasee, no dude en llevar a su loro con usted, ¡incluso para un trayecto de media hora! Y si tiene 2 loros, no hay problema, existen mochilas dobles. Consulte la ficha PakObird Doble medium.<br /><span style=text-decoration: underline;><strong>Detalles:</strong></span><br /><ul><br />    <li><img src=http://www.colony-loros.es/media/wysiwyg/2/0/2012040302380712.jpg alt= /> Se proporcionan 2 listones de plástico para volver rígida la apertura de la mochila.</li><br />  <li><img src=http://www.colony-loros.es/media/wysiwyg/2/0/2012040302380611.jpg alt= /> Las mochilas PakObird fueron diseñadas con materiales muy sólidos. Pero nada resiste el pico de un loro que se aburre. Para evitar que su pájaro se interese en la mochila en sí, cuelgue un juguete en ella cuando salga de paseo. En su interior están previstos enganches de acero (sobre los refuerzos de plástico). Cuelgue el juguete al enganche superior, y para evitar que se balancee contra su loro cuando usted camina, fije su extremidad a un segundo enganche previsto a este efecto. El sistema de enganche está hecho para fijar 4 juguetes, 2 de cada lado.</li><br /> <li><img src=http://www.colony-loros.es/media/wysiwyg/2/0/2012040302380510.jpg alt= /> Si su loro es un poco demasiado curioso, se puede agregar una protección interior que impedirá a este pico inquisidor interesarse de muy cerca en la cremallera! Este kit se coloca muy fácilmente y protege a toda la cremallera interna. Vea el producto Protection.</li><br />    <li><img src=http://www.colony-loros.es/media/wysiwyg/2/0/201204030238049.jpg alt= /> Fue previsto un fondo de plástico lavable para recoger los excrementos de su pájaro. Y retirando los listones de refuerzo, puede fácilmente abrir su mochila y limpiar todo en el interior. Los materiales utilizados son resistentes al agua.</li><br /> <li><img src=http://www.colony-loros.es/media/wysiwyg/2/0/201204030238038.jpg alt= /> Las mochilas PakObird pueden colgarse fácilmente en un auto con un cinturón de seguridad. 2 correderas están previstas a este efecto.</li><br />  <li><img src=http://www.colony-loros.es/media/wysiwyg/2/0/201204030237572.jpg alt= /> Cada mochila PakObird se entrega con una percha de « Dragon Wood », y dos comederos ¡para la comodidad de su loro durante vuestro paseo!</li><br />   <li><img src=http://www.colony-loros.es/media/wysiwyg/2/0/201204030237561.jpg alt= /> La ventilación es garantizada por una rejilla de acero inoxidable, para evitar eventuales roturas. La rejilla se encuentra en 3 lados (delante, costado derecho, costado izquierdo). Una tira de rejilla está en la parte trasera para dejar una mínima ventilación cuando el bolso está recubierto por sus telas de protección.</li><br />   <li><img src=http://www.colony-loros.es/media/wysiwyg/2/0/2012040302380813.jpg alt= /> Se provee una correa adicional para llevar la mochila como bandolera en el hombro. Todas las correas son regulables y acolchadas para su comodidad.</li><br />   <li><img src=http://www.colony-loros.es/media/wysiwyg/2/0/2012040302380914.jpg alt= /> Al dorso de la mochila encontrará 4 ganchos triangulares. Los dos ganchos del medio se utilizan para enganchar las correas y llevar la mochila sobre la espalda. Los dos ganchos externos se utilizan para llevar la mochila en el pecho.</li><br /> <li><img src=http://www.colony-loros.es/media/wysiwyg/2/0/2012040302381015.jpg alt= /> Las mochilas PakObird pueden ser llevadas sobre la espalda, pecho, o sobre el hombro.</li><br /> <li><img src=http://www.colony-loros.es/media/wysiwyg/2/0/2012040302381116.jpg alt= /> La mochila puede estar íntegramente recubierta. El acceso del frente está recubierto por una tela que se despliega y se engancha con un Velcro. En el lateral, las telas se despliegan y se enganchan con un mosquetón. Estas telas permiten también proteger a su loro del sol.</li><br />  <li><img src=http://www.colony-loros.es/media/wysiwyg/2/0/2012040302381217.jpg alt= /> La altura de la percha es regulable según 3 alturas diferentes (10, 15, o 20 cm. del suelo) en función del tamaño de la cola de su loro o de su perico.</li><br /></ul><br />@http://casadelave-tiendaonline.com/wordpress/wp-content/uploads/2015/04/201204030238153.jpg|http://casadelave-tiendaonline.com/wordpress/wp-content/uploads/2015/04/201204030238164.jpg|http://casadelave-tiendaonline.com/wordpress/wp-content/uploads/2015/04/201204030238131.jpg
